{
  "schema_version": "dsvire.symbol-evidence.v2",
  "datasheet": {
    "id": "ti-slvs632l",
    "content_sha256": "83074fc1265c8e5c6639511bdb9f83e96c6e6f993613deadea0d09c3a12a2c07",
    "manufacturer": "Texas Instruments",
    "mpn": "TPS5430DDAR",
    "package": "SO-PowerPAD-8"
  },
  "identity_verification": {
    "method": "exact_text_orderable_part",
    "policy_version": "fixture.identity-text@1.0.0",
    "outcome": "accepted",
    "manufacturer_observed": true,
    "exact_mpn_observed": true,
    "package_associated": true,
    "evidence_region_ids": [
      "r_package_01"
    ]
  },
  "regions": [
    {
      "region_id": "r_pinout_01",
      "type": "pinout",
      "page": 3,
      "bbox_norm": [
        0.229,
        0.126,
        0.776,
        0.328
      ],
      "crop_uri": "dsvire://fixture/tps5430ddar/r_pinout_01.webp",
      "content_hash": "sha256:5a42314371835832318cd2bd76e0d16626a72f5c067d60c4e40123afacaf58f1",
      "verification": {
        "method": "text_layout_heuristic",
        "policy_version": "fixture.text-layout@1.0.0",
        "outcome": "accepted",
        "score": 0.97,
        "score_semantics": "heuristic_evidence_strength"
      },
      "caption": "Figure 4-1. DDA Package 8-Pin HSOIC With Thermal Pad (Top View)"
    },
    {
      "region_id": "r_pin_table_01",
      "type": "table",
      "page": 3,
      "bbox_norm": [
        0.065,
        0.328,
        0.935,
        0.6
      ],
      "crop_uri": "dsvire://fixture/tps5430ddar/r_pin_table_01.webp",
      "content_hash": "sha256:7ba91a7a845405841de343da22a4ca32903a4416f742a47da13f83ddf3f86ee3",
      "verification": {
        "method": "text_layout_heuristic",
        "policy_version": "fixture.text-layout@1.0.0",
        "outcome": "accepted",
        "score": 0.94,
        "score_semantics": "heuristic_evidence_strength"
      },
      "caption": "Table 4-1. Pin Functions"
    },
    {
      "region_id": "r_package_01",
      "type": "package",
      "page": 3,
      "bbox_norm": [
        0.229,
        0.126,
        0.776,
        0.328
      ],
      "crop_uri": "dsvire://fixture/tps5430ddar/r_package_01.webp",
      "content_hash": "sha256:5a42314371835832318cd2bd76e0d16626a72f5c067d60c4e40123afacaf58f1",
      "verification": {
        "method": "text_layout_heuristic",
        "policy_version": "fixture.text-layout@1.0.0",
        "outcome": "accepted",
        "score": 1.0,
        "score_semantics": "heuristic_evidence_strength"
      },
      "caption": "DDA package identity and top-view pinout"
    }
  ],
  "retrieval": {
    "index_version": "fixture@1",
    "model_ids": [
      "fixture"
    ],
    "query_ids": [
      "q_pinout",
      "q_pin_table"
    ]
  }
}
